{
  "$schema": "./tokens.schema.json",
  "meta": {
    "name": "IAMJARL Design System",
    "version": "1.22.1",
    "updated": "2026-10-11",
    "source": "IAMJARL Design System"
  },
  "brand": {
    "name": "IAMJARL",
    "icons": {
      "library": "phosphor",
      "nativeLibrary": "sf-symbols",
      "defaultWeight": "regular",
      "weightsAllowed": [
        "thin",
        "light",
        "regular",
        "bold",
        "fill",
        "duotone"
      ],
      "defaultSizes": [
        16,
        20,
        24,
        28
      ]
    },
    "typography": {
      "family": {
        "ui": "system-ui, -apple-system, 'Segoe UI', Roboto, sans-serif",
        "mono": "ui-monospace, SFMono-Regular, Menlo, Consolas, 'Liberation Mono', monospace"
      },
      "display": {
        "mono": {
          "name": "JetBrains Mono",
          "stack": "'JetBrains Mono', ui-monospace, SFMono-Regular, Menlo, monospace",
          "licence": "OFL-1.1",
          "use": "Gear, timers and data — anywhere the number is the interface.",
          "file": "jetbrains-mono-latin-wght-normal.woff2",
          "weights": "100 800",
          "source": "@fontsource-variable/jetbrains-mono@5.3.0"
        },
        "geometric": {
          "name": "Outfit",
          "stack": "'Outfit', system-ui, -apple-system, 'Segoe UI', sans-serif",
          "licence": "OFL-1.1",
          "use": "Tools. Precise and modern, for products that present themselves as instruments.",
          "file": "outfit-latin-wght-normal.woff2",
          "weights": "100 900",
          "source": "@fontsource-variable/outfit@5.3.0"
        },
        "humanist": {
          "name": "Instrument Sans",
          "stack": "'Instrument Sans', system-ui, -apple-system, 'Segoe UI', sans-serif",
          "licence": "OFL-1.1",
          "use": "Health and calm, where a site should not read as an instrument.",
          "file": "instrument-sans-latin-wght-normal.woff2",
          "weights": "400 700",
          "source": "@fontsource-variable/instrument-sans@5.3.0"
        },
        "serif": {
          "name": "Fraunces",
          "stack": "'Fraunces', Georgia, 'Times New Roman', serif",
          "licence": "OFL-1.1",
          "use": "Calm and care: a soft serif for headlines, where a site should feel warm and unhurried. Chosen for Walkful (#65).",
          "file": "fraunces-latin-soft-normal.woff2",
          "weights": "100 900",
          "axes": "'SOFT' 100",
          "source": "@fontsource-variable/fraunces@5.3.0"
        }
      },
      "weights": {
        "regular": 400,
        "semibold": 600,
        "bold": 700
      },
      "sizes": {
        "xs": 12,
        "sm": 14,
        "base": 16,
        "lg": 18,
        "xl": 24,
        "xxl": 36
      },
      "lineHeights": {
        "xs": 16,
        "sm": 20,
        "base": 24,
        "lg": 28,
        "xl": 32,
        "xxl": 44
      },
      "numerals": {
        "sm": 32,
        "md": 56,
        "lg": 80
      }
    }
  },
  "tokens": {
    "radius": {
      "sm": 8,
      "md": 12,
      "lg": 16
    },
    "spacing": {
      "xs": 4,
      "sm": 8,
      "md": 12,
      "lg": 16,
      "xl": 20,
      "xxl": 24,
      "xxxl": 32
    },
    "colors": {
      "static": {
        "black": "#000000",
        "white": "#FFFFFF"
      },
      "shared": {
        "success": "#4CAF50",
        "onSuccess": "#000000",
        "warning": "#FF6B35",
        "onWarning": "#000000",
        "error": "#D70015",
        "onError": "#FFFFFF"
      },
      "modes": {
        "light": {
          "primary": "#A435D2",
          "onPrimary": "#FFFFFF",
          "primaryHover": "#8E2BB8",
          "primaryPressed": "#7A2499",
          "primarySubtle": "rgba(164, 53, 210, 0.12)",
          "text": {
            "primary": "#000000",
            "secondary": "rgba(0, 0, 0, 0.70)",
            "tertiary": "rgba(0, 0, 0, 0.55)",
            "disabled": "rgba(0, 0, 0, 0.35)",
            "inverse": "#FFFFFF"
          },
          "background": {
            "app": "#FFFFFF",
            "muted": "rgba(0, 0, 0, 0.04)",
            "card": "rgba(0, 0, 0, 0.04)",
            "disabled": "rgba(0, 0, 0, 0.06)"
          },
          "surface": {
            "default": "#FFFFFF",
            "raised": "rgba(0, 0, 0, 0.02)"
          },
          "border": {
            "subtle": "rgba(0, 0, 0, 0.10)",
            "default": "rgba(0, 0, 0, 0.16)"
          },
          "state": {
            "success": "#2E7D32",
            "warning": "#C2410C",
            "error": "#D70015"
          },
          "gradients": {
            "primary": "linear-gradient(135deg, #A435D2, #E0529C)",
            "brand": "linear-gradient(135deg, #D0FF00, #A435D2)"
          }
        },
        "dark": {
          "primary": "#D0FF00",
          "onPrimary": "#000000",
          "primaryHover": "#B8E000",
          "primaryPressed": "#A0C400",
          "primarySubtle": "rgba(208, 255, 0, 0.15)",
          "text": {
            "primary": "#FFFFFF",
            "secondary": "rgba(255, 255, 255, 0.75)",
            "tertiary": "rgba(255, 255, 255, 0.60)",
            "disabled": "rgba(255, 255, 255, 0.35)",
            "inverse": "#000000"
          },
          "background": {
            "app": "#000000",
            "muted": "rgba(255, 255, 255, 0.05)",
            "card": "rgba(255, 255, 255, 0.05)",
            "disabled": "rgba(255, 255, 255, 0.07)"
          },
          "surface": {
            "default": "#000000",
            "raised": "rgba(255, 255, 255, 0.03)"
          },
          "border": {
            "subtle": "rgba(255, 255, 255, 0.12)",
            "default": "rgba(255, 255, 255, 0.18)"
          },
          "state": {
            "success": "#4CAF50",
            "warning": "#FF6B35",
            "error": "#FF453A"
          },
          "gradients": {
            "primary": "linear-gradient(135deg, #D0FF00, #5DE0A6, #37B6E9)",
            "brand": "linear-gradient(135deg, #A435D2, #D0FF00)"
          }
        }
      }
    },
    "shadows": {
      "sm": {
        "x": 0,
        "y": 1,
        "blur": 2,
        "opacity": 0.05
      },
      "md": {
        "x": 0,
        "y": 4,
        "blur": 8,
        "opacity": 0.08
      },
      "lg": {
        "x": 0,
        "y": 8,
        "blur": 24,
        "opacity": 0.12
      }
    },
    "motion": {
      "duration": {
        "fast": 150,
        "normal": 250,
        "slow": 400
      },
      "easing": {
        "standard": [
          0.4,
          0,
          0.2,
          1
        ],
        "emphasized": [
          0.2,
          0,
          0,
          1
        ]
      }
    },
    "container": {
      "sm": 680,
      "md": 900,
      "lg": 1080,
      "xl": 1400
    },
    "marketing": {
      "viewport": {
        "min": 375,
        "max": 1280
      },
      "type": {
        "display": {
          "min": 52,
          "max": 96,
          "leading": 1.02,
          "tracking": -0.02
        },
        "headline": {
          "min": 34,
          "max": 56,
          "leading": 1.08,
          "tracking": -0.015
        },
        "title": {
          "min": 22,
          "max": 28,
          "leading": 1.25,
          "tracking": -0.005
        },
        "lead": {
          "min": 19,
          "max": 23,
          "leading": 1.5,
          "tracking": 0
        },
        "body": {
          "min": 18,
          "max": 19,
          "leading": 1.6,
          "tracking": 0
        },
        "small": {
          "min": 15,
          "max": 16,
          "leading": 1.5,
          "tracking": 0
        },
        "numeral": {
          "min": 64,
          "max": 128,
          "leading": 1,
          "tracking": -0.03
        },
        "wordmark": {
          "min": 76,
          "max": 240,
          "leading": 0.9,
          "tracking": -0.03
        }
      },
      "space": {
        "gutter": {
          "min": 20,
          "max": 64
        },
        "stack": {
          "min": 20,
          "max": 32
        },
        "block": {
          "min": 48,
          "max": 88
        },
        "section": {
          "min": 88,
          "max": 168
        }
      },
      "width": {
        "content": 1100,
        "text": 640,
        "narrow": 760
      }
    },
    "breakpoints": {
      "popup": 320,
      "sm": 640,
      "md": 768,
      "lg": 1024,
      "xl": 1280,
      "xxl": 1536
    },
    "focus": {
      "width": 2,
      "offset": 2
    },
    "zIndex": {
      "base": 0,
      "dropdown": 1000,
      "sticky": 1100,
      "overlay": 1200,
      "modal": 1300,
      "popover": 1400,
      "toast": 1500,
      "tooltip": 1600
    },
    "opacity": {
      "disabled": 0.4,
      "muted": 0.65
    }
  },
  "guidance": {
    "primaryUsage": [
      "Primary is used for main CTA buttons, links, progress indicators, and key highlights.",
      "Avoid using primary for destructive actions."
    ],
    "statesUsage": [
      "Success is used for confirmations and completed states.",
      "Warning is used for attention without error.",
      "Error is used for destructive actions and validation errors."
    ],
    "darkMode": [
      "All products must support both light and dark mode.",
      "Never hardcode pure black or white outside of tokens.colors.static."
    ]
  }
}
